{
  "$schema": "./registry.schema.json",
  "name": "s1933-skills-registry",
  "description": "Flat registry of agent skills to install via 'npx skills add'. Hybrid of mattpocock/skills (engineering) and obra/superpowers (orchestration). Each entry has a role (discovery/design/implementation/setup/quality/delivery/style) documenting why the skill is in the registry. Excludes obra/superpowers/brainstorming (HARD-GATE incompatible with the Matt+Superpowers hybrid).",
  "version": "1.0.6",
  "generated_at": "2026-09-18",
  "count": 31,
  "skills": [
    {
      "name": "caveman",
      "owner": "juliusbrussee",
      "repo": "caveman",
      "role": "style"
    },
    {
      "name": "code-review",
      "owner": "mattpocock",
      "repo": "skills",
      "role": "quality"
    },
    {
      "name": "codebase-design",
      "owner": "mattpocock",
      "repo": "skills",
      "role": "design"
    },
    {
      "name": "diagnosing-bugs",
      "owner": "mattpocock",
      "repo": "skills",
      "role": "quality"
    },
    {
      "name": "domain-modeling",
      "owner": "mattpocock",
      "repo": "skills",
      "role": "design"
    },
    {
      "name": "executing-plans",
      "owner": "obra",
      "repo": "superpowers",
      "role": "implementation"
    },
    {
      "name": "finishing-a-development-branch",
      "owner": "obra",
      "repo": "superpowers",
      "role": "delivery"
    },
    {
      "name": "grill-with-docs",
      "owner": "mattpocock",
      "repo": "skills",
      "role": "discovery"
    },
    {
      "name": "grilling",
      "owner": "mattpocock",
      "repo": "skills",
      "role": "discovery"
    },
    {
      "name": "handoff",
      "owner": "mattpocock",
      "repo": "skills",
      "role": "delivery"
    },
    {
      "name": "i-have-adhd",
      "owner": "ayghri",
      "repo": "i-have-adhd",
      "role": "style"
    },
    {
      "name": "improve-codebase-architecture",
      "owner": "mattpocock",
      "repo": "skills",
      "role": "design"
    },
    {
      "name": "karpathy-guidelines",
      "owner": "multica-ai",
      "repo": "andrej-karpathy-skills",
      "role": "quality"
    },
    {
      "name": "prototype",
      "owner": "mattpocock",
      "repo": "skills",
      "role": "design"
    },
    {
      "name": "receiving-code-review",
      "owner": "obra",
      "repo": "superpowers",
      "role": "quality"
    },
    {
      "name": "requesting-code-review",
      "owner": "obra",
      "repo": "superpowers",
      "role": "quality"
    },
    {
      "name": "security-audit",
      "owner": "cloudflare",
      "repo": "security-audit-skill",
      "role": "quality"
    },
    {
      "name": "security-review",
      "owner": "getsentry",
      "repo": "skills",
      "role": "quality"
    },
    {
      "name": "setup-matt-pocock-skills",
      "owner": "mattpocock",
      "repo": "skills",
      "role": "setup"
    },
    {
      "name": "show-me",
      "owner": "humanlayer",
      "repo": "skills",
      "role": "style"
    },
    {
      "name": "stop-slop",
      "owner": "hardikpandya",
      "repo": "stop-slop",
      "role": "style"
    },
    {
      "name": "subagent-driven-development",
      "owner": "obra",
      "repo": "superpowers",
      "role": "implementation"
    },
    {
      "name": "tdd",
      "owner": "mattpocock",
      "repo": "skills",
      "role": "implementation"
    },
    {
      "name": "tech-debt",
      "owner": "anthropics",
      "repo": "knowledge-work-plugins",
      "role": "quality"
    },
    {
      "name": "to-spec",
      "owner": "mattpocock",
      "repo": "skills",
      "role": "design"
    },
    {
      "name": "to-tickets",
      "owner": "mattpocock",
      "repo": "skills",
      "role": "design"
    },
    {
      "name": "triage",
      "owner": "mattpocock",
      "repo": "skills",
      "role": "quality"
    },
    {
      "name": "using-git-worktrees",
      "owner": "obra",
      "repo": "superpowers",
      "role": "implementation"
    },
    {
      "name": "verification-before-completion",
      "owner": "obra",
      "repo": "superpowers",
      "role": "delivery"
    },
    {
      "name": "wait-what",
      "owner": "mattpocock",
      "repo": "skills",
      "role": "style"
    },
    {
      "name": "writing-for-agents",
      "owner": "mattpocock",
      "repo": "skills",
      "role": "design"
    }
  ]
}
